id,pergunta,resposta,arquivo_fonte
83,"Como criar agenda de consultas no sistema ADS Hospitalar?



","Para criar uma agenda de consultas ambulatoriais no sistema ADSHospitalar, siga estes passos:

1.  Acesse o sistema ADSHospitalar e vá no menu Cadastros -> Profissionais.
2.  Na tela de Profissionais, digite o nome do profissional para o qual será criada a grade e selecione a opção Buscar.
3.  Caso o cadastro não exista, selecione a opção + Cadastrar Profissional. Preencha todos os dados e selecione a opção Salvar. Importante: em caso de criação de grade para equipe (nome da equipe, ao invés de nome de profissional), será necessário informar um número de conselho fictício, que contenha 10 dígitos.
4.  No cadastro do profissional, confira se a especialidade está correta e se necessário, atualize o cadastro.
5.  Após atualizar o cadastro do profissional, inclua o profissional ao serviço solicitado, indo no menu Agenda -> Serviço X Profissional. Na tela do sistema, selecione o serviço e o profissional e clique no botão OK para salvar.
6.  Após a vinculação do profissional ao serviço, crie a grade ambulatorial, indo no menu Agenda -> Profissionais X HR. Atendimento. O sistema irá apresentar a tela para a inclusão da grade. Selecione o serviço e o profissional, clicando no botão OK para verificar se já existe uma grade criada.
7.  Caso não exista nenhuma grade criada para o serviço/profissional, preencha os campos para a criação da grade, conforme os dados informados no chamado GLPI. Após o preenchimento, selecione a opção OK para salvar a grade.",Esta resposta foi formulada com base no(s) documento(s): POP.SETISD.012 CRIAR AGENDA DE CONSULTAS AMBULATORIAIS NO SISTEMA ADSHOSPITALAR.docx
84,"Como excluir uma APAC?



","Para excluir uma APAC, a TI toma conhecimento da necessidade através de um chamado aberto no GLPI, onde devem constar o nome completo do paciente e o número ou data da APAC. Ao invés de excluir, a APAC é inativada no banco de dados, alterando o status para 'I' (inativo). Para isso, é necessário buscar o ID da solicitação referente à APAC informada através do nome do paciente e, em seguida, executar o comando `UPDATE po_apacs_solicitacoes SET status = 'I' WHERE id = 00000;` substituindo o ID.",Esta resposta foi formulada com base no(s) documento(s): POP.SETISD.029 EXCLUIR UMA APAC.docx
85,"Como ingressar um computador no AD?



","Para ingressar um computador com Windows 10 no Active Directory (AD) da EBSERH, siga os seguintes passos:

1.  Verifique se o computador já possui cadastro no Active Directory. Consulte no AD, utilizando o botão Localizar (EBSERH > HEPEL > Botão Direito > Localizar). Se a máquina possuir etiqueta no padrão HEPEL-WK-0XXXX, verifique se o cadastro já está habilitado. Se for uma máquina nova, cadastre-a no AD antes de iniciar o processo. Use o RSAT, clique em HEPEL > Computadores > Novo > Computador, informe o nome no padrão HEPEL-WK-0XXXX, observando a numeração do último computador já cadastrado. Após cadastrar, clique com o botão direito, selecione propriedades e escreva a descrição da máquina, no padrão adotado pelo SETISD, que envolve a descrição da Localização + Sub localização.
2.  Faça login no computador utilizando o usuário administrador local da máquina.
3.  Para trocar o nome do computador e a descrição, pressione a tecla Windows + tecla Pause/Break, selecione Alterar configurações, altere a Descrição do computador, depois selecione Alterar... e mude o Nome do computador. Pressione OK, salve as configurações e reinicie a máquina.
4.  Após reiniciar, faça login com o administrador local novamente.
5.  Ingresse o computador no domínio EBSERH através do ID de Rede. Pressione a tecla Windows + tecla Pause/Break, selecione Alterar configurações, depois escolha ID de rede. Na próxima tela, selecione a opção “Este computador faz parte de uma rede corporativa” e pressione Avançar. Após isso, selecione “Minha empresa usa uma rede com domínio” e pressione Avançar. Irá aparecer uma tela com informações para prosseguir com a operação, pressione Avançar. Informe o nome do usuário, a senha e o nome do domínio EBSERHNET.EBSERH.GOV.BR.
6.  Irá abrir uma tela informando que foi encontrada uma conta para este computador e perguntando se deseja utilizá-la, pressione Não. Irá abrir uma tela pedindo para confirmar o nome do computador e o domínio, preencha os dados e avance para a próxima etapa. Informe novamente o nome do usuário administrador da rede (adm.lcosta), a senha e o domínio EBSERHNET.EBSERH.GOV.BR.
7.  Na próxima tela, irá perguntar se você deseja adicionar o usuário como usuário de domínio, pressione Sim. Conceda o nível de acesso Administrador para o usuário e pressione Avançar.
8.  Pressione Concluir, depois clique em OK e reinicie a máquina. Faça login com o usuário, para criar o perfil no computador.
9.  Desabilite o firewall do Windows. Pressione Windows + R, escreva firewall.cpl, clique em OK, selecione “Ativar ou Desativar o Windows Defender Firewall” e desative o firewall.

Após esses passos, o computador estará inserido no AD EBSERH.",Esta resposta foi formulada com base no(s) documento(s): POP.SETISD.019 INGRESSAR UM COMPUTADOR COM WINDOWS 10 NO AD EBSERH.docx
86,"Como cadastrar leito no sistema AGHUX?



","Para cadastrar um novo leito no sistema AGHU, siga os passos: acesse o sistema AGHUx através do link https://aghu.heufpel.com.br/. No menu, vá em Internação -> Cadastros -> Quartos e Leitos -> Quartos e Leitos. Na tela de pesquisa, encontre a enfermaria desejada e clique no ícone de edição. Na tela Cadastrar Quarto, clique no botão Adicionar para criar um novo leito. Preencha todos os campos no formulário de cadastro de leitos e clique em Confirmar. Após incluir todos os leitos desejados, clique no botão Gravar. Para verificar o novo leito, vá no menu Internação -> Censo Diário dos Pacientes, selecione a unidade funcional e clique em Pesquisar. Se o leito estiver desativado, ative-o.",Esta resposta foi formulada com base no(s) documento(s): POP.SETISD.011 CADASTRAR LEITOS NO SISTEMA AGHUX.docx
87,"Como atender alterações de dados nos sistemas?
","O Setor de Tecnologia da Informação e Saúde Digital poderá alterar dados em sistemas, caso alguma informação incorreta tenha sido registrada pelo usuário e o sistema não forneça funcionalidade para tal ajuste de dados. Esta alteração será realizada diretamente na base de dados, mediante justificativa do usuário através de chamado GLPI. Para dados assistenciais, a chefia da unidade/setor deverá abrir um processo no SEI, criar um despacho informando as alterações necessárias e a justificativa, assiná-lo e encaminhá-lo para a unidade USID/SETISD/SUP/HE-UFPel, e também abrir um chamado no sistema GLPI. Para dados administrativos, a abertura do chamado deverá ser realizada apenas via GLPI pela chefia do setor/unidade ou colaborador para o qual a chefia delegou formalmente esta função, justificando a alteração. A equipe técnica deverá verificar o chamado e atribuí-lo ao colaborador responsável pela solução. A USID deverá analisar a solicitação e, caso a alteração seja em relação a sistemas desenvolvidos pela Sede, deverá ser aberto um chamado através da ferramenta SAPE Sistemas, e o número do SAPE deverá ser incluído no acompanhamento do chamado GLPI. Caso seja um sistema desenvolvido pelo Hospital, a alteração deverá ser realizada via base de dados. Deverá ser incluído no chamado GLPI as fotos do sistema antes e depois da alteração, contendo os dados. Após a solução, o chamado GLPI deverá ser finalizado. Caso também tenha sido aberto processo no SEI, o mesmo deverá ser concluído, através de um despacho informando o número do GLPI. Nos acompanhamentos do chamado no GLPI também deverá constar o número do processo SEI. Caso esteja aguardando resolução pela sede, o chamado deverá permanecer com a situação “Pendente” e o número do chamado no SAPE deverá ser adicionado ao acompanhando da ferramenta GLPI.",Esta resposta foi formulada com base no(s) documento(s): POP.SETISD.008 ATENDER SOLICITAÇÃO DE ALTERAÇÃO DE DADOS EM SISTEMAS.docx
88,"Como gerar relatório mensal da terceirizada?
","Para gerar o relatório mensal de tarefas concluídas pela empresa terceirizada, o fiscal do contrato deve acessar a ferramenta Redmine com o login/senha de rede, selecionar o projeto desenvolvido pela empresa no mês, ir na aba Tarefas e filtrar pela situação diferente de Nova, adicionar o filtro Atribuído para com os nomes dos colaboradores da empresa, e colocar o filtro Início maior ou igual ao primeiro dia do mês para faturamento. Após aplicar o filtro, selecionar a opção CSV e Exportar.",Esta resposta foi formulada com base no(s) documento(s): POP.SETISD.014 GERAR RELATÓRIO MENSAL DE TAREFAS CONCLUÍDAS PELA EMPRESA TERCEIRIZADA DE DESENVOLVIMENTO.docx
89,"Como gerar relatórios dos sistemas?
","O Setor de Tecnologia da Informação e Saúde Digital desenvolve relatórios a partir de dados gerados por sistemas de informação da instituição para atender necessidades de informações adicionais, não disponíveis no sistema, ou compiladas para serem analisadas. Os relatórios podem ser solicitados pelas chefias de unidade/setor, estatístico do hospital ou Gerência de Ensino e Pesquisa (GEP). A solicitação é feita via GLPI, e no caso da GEP, deve haver um projeto formalizado para justificar a extração dos dados. A equipe técnica verifica o chamado no GLPI e atribui ao grupo SETISD - Sistemas. O relatório é desenvolvido em Excel ou Power BI e disponibilizado no chamado, incluindo a consulta SQL utilizada, que também é armazenada no One Drive da USID. Se o relatório for periódico, a chefia deve solicitar a inclusão no sistema ADS Hospitalar ou Painel de Gestão.",Esta resposta foi formulada com base no(s) documento(s): POP.SETISD.007 ATENDER SOLICITAÇÃO PARA GERAÇÃO DE RELATÓRIOS DE SISTEMAS.docx
90,"Como fazer melhorias dos sistemas?
","Para solicitar melhorias ou novas funcionalidades nos sistemas do Hospital, a chefia ou chefia substituta de uma unidade/setor deve abrir um chamado através da ferramenta GLPI para o Setor de Tecnologia da Informação e Saúde Digital. A equipe técnica verifica o chamado, atribui ao grupo SETISD - Sistemas e, caso o chamado tenha sido aberto por um colaborador que não é chefia, ele é solucionado indicando essa razão. Um colaborador do SETISD - Sistemas verifica o chamado, atribui para si e atualiza a situação para “Em atendimento”. É realizada uma reunião para esclarecimento da demanda e levantamento dos requisitos iniciais. Após isso, a demanda é encaminhada ao Comitê de Tecnologia da Informação para aprovação e priorização. Se aprovada, a melhoria entra na fila de desenvolvimento, e o colaborador do SETISD - Sistemas atualiza o chamado no GLPI, informando a aprovação ou não pelo comitê de TI. Se aprovada, a demanda tem seus requisitos validados, e é desenvolvida ou alterada a História de Usuário, com a contagem de pontos de função. A História de Usuário é armazenada no One Drive da USID. Após a validação da História de Usuário pelo requisitante, o chamado GLPI é atualizado para “Lista de Espera”, aguardando o desenvolvimento. No Redmine, é criada uma tarefa para a demanda, incluindo os requisitos, a contagem de pontos de função e a referência ao chamado GLPI. O GLPI é atualizado com o número da tarefa do Redmine e a estimativa de prazo. Após o início do desenvolvimento, a tarefa no Redmine é atualizada para “em andamento” e o chamado GLPI para “em atendimento”. Em caso de programador de empresa terceirizada, ele deve desenvolver a demanda no prazo estabelecido pela contagem de pontos de função, indicada na tarefa.",Esta resposta foi formulada com base no(s) documento(s): POP.SETISD.006 ATENDER SOLICITAÇÃO DE MELHORIAS E NOVAS FUNCIONALIDADES EM SISTEMAS.docx
91,"Como habilitar internação no AGHUX?

","Para habilitar um procedimento de internação no sistema AGHU, siga os passos:

1.  Acesse o sistema AGHU através do endereço http://aghu.heufpel.com.br, utilizando seu login e senha de rede.
2.  No sistema AGHU, acesse o menu Financeiro -> Faturamento -> Cadastros -> Tabelas -> Item Procedimento Hospitalar.
3.  Na tela de listagem de procedimentos, digite o código do procedimento no campo Código SUS e selecione a opção Pesquisar.
4.  Após encontrar o cadastro, selecione a opção Editar para acessar os dados de cadastro do procedimento.
5.  No cadastro do procedimento, marque a opção Internação e após selecione a opção Gravar, que fica no final da página, para salvar os dados.",Esta resposta foi formulada com base no(s) documento(s): POP.SETISD.009 HABILITAR PROCEDIMENTO DE INTERNAÇÃO NO SISTEMA AGHU.docx
92,"Como criar tarefa de desenvolvimento?


","Para criar uma tarefa de desenvolvimento no Redmine, siga estes passos:

1.  Acesse a ferramenta Redmine através do endereço http://projetos.heufpel.com.br/redmine, utilizando o login e senha de rede.
2.  Acesse o menu Projetos e escolha o sistema desejado (ex: Sistema ADSHospitalar, Sistema ADSNutri).
3.  Na aba Tarefas, selecione a opção Nova Tarefa.
4.  Preencha os campos do formulário, como Tipo (defeito, melhoria, etc.), Título (incluir 'OS' + número da ordem de serviço, se aplicável), Situação (Nova, Em Andamento, etc.), Atribuído para (programador ou equipe), e adicione os Arquivos necessários (histórias de usuários, contagem de pontos de função, ordem de serviço, etc.).
5.  Atualize o campo Início com a data de início da tarefa.
6.  Preencha o Tempo estimado, calculando 4 horas por ponto de função para melhorias em PHP/HTML/Javascript, ou definindo o prazo de duas horas para defeitos/garantia de pós-publicação.",Esta resposta foi formulada com base no(s) documento(s): POP.SETISD.015 CRIAR TAREFA DE DESENVOLVIMENTO DE SISTEMAS NO REDMINE.docx
93,"Como criar tarefa de desenvolvimento?


","Para criar uma tarefa de desenvolvimento no Redmine, após a validação e aprovação dos requisitos pelo demandante, acesse a ferramenta Redmine através do endereço http://projetos.heufpel.com.br/redmine, utilizando o mesmo login/senha de rede. Após estar logado, acesse o menu Projetos, escolha o sistema desejado e vá na aba Tarefas. Selecione a opção Nova Tarefa e preencha os campos do formulário, como Tipo, Título, Situação, Atribuído para, Arquivos, Início e Tempo estimado.",Esta resposta foi formulada com base no(s) documento(s): POP.SETISD.015 CRIAR TAREFA DE DESENVOLVIMENTO DE SISTEMAS NO REDMINE.docx
94,"Como unificar cadastros no PACS?


","Para unificar cadastros replicados no PACS (DCM4CHEE), siga os seguintes passos:

1.  Encontre o cadastro com as informações corretas no ADS Hospitalar ou AGHU para servir de gabarito, priorizando cadastros com ID de prontuário, CPF, Cartão SUS e Nome da Mãe.
2.  Acesse o DCM4CHEE como administrador.
3.  Selecione a opção ""Search for"" para ""Patient (with or without studies)"".
4.  Pesquise pelo ID do paciente, e posteriormente, pelo nome.
5.  Expanda as linhas cinzas (informação dos pacientes) para tornar visíveis as linhas verdes (informação do exame).
6.  Certifique-se de que os exames (linhas verdes) estejam em um único cadastro (linha cinza) sem informações erradas e com o Issuer identificado como ""ADSHOSPITALAR"".
7.  Dê preferência para cadastros não expansíveis com o Issuer já preenchido ou que possa ser inserido.
8.  Se necessário, crie um novo cadastro com as informações corretas e o Issuer ""ADSHOSPITALAR"".
9.  Clique no cadastro correto com o CTRL pressionado para fixá-lo (ficará laranja).
10. Selecione os exames dos outros cadastros da mesma maneira.
11. Clique em Move e depois em Move na próxima janela.
12. Apague os cadastros vazios quando o DCM4CHEE perguntar.
13. Fixe o cadastro ajustado com o CTRL pressionado.
14. Clique no botão Reset.
15. Repita os passos 15, 16 e 17 caso surjam mais resultados na pesquisa por nome.","Esta resposta foi formulada com base no(s) documento(s): POP.SETISD.017 UNIFICAR CADASTROS NO PACS DCM4CHEE.docx, POP.SETISD.016 CONFERIR WORKLIST PACSADS HOSPITALAR.docx"
95,Como habilitar encaminhamento de chamada?,"Para habilitar o encaminhamento de chamada, acesse a Central Telefônica através da interface web, no endereço 10.100.208.21. Entre com o username e password do administrador. Selecione a opção ""PBX Basic"", subitem ""Extensions"" e edite as configurações do ramal para o qual deseja a alteração. Na aba Options, altere o campo ""Call Forward"" de acordo com as instruções. A primeira coluna representa quando o encaminhamento deve ser feito: Always (sempre encaminhar), On Unavailable (somente quando indisponível) ou When Busy (somente quando ocupado). A segunda coluna representa o tipo de encaminhamento: Voicemail (para o correio de voz), Number (para outro ramal) ou Hang-up (finaliza a ligação). Após alterar o item ""Call Forward"", clique em ""Save"" e depois em ""Apply Configurations Changes Here"".",Esta resposta foi formulada com base no(s) documento(s): POP.SETISD.023 HABILITAR ENCAMINHAMENTO DE CHAMADA NO RAMAL.docx
96,"Como corrigir número de uma APAC?
","Para corrigir o número da autorização de uma APAC, a TI deve tomar conhecimento através de um chamado no GLPI, informando o nome completo do paciente, o número errado da APAC e o número correto. Opcionalmente, pode-se informar a data da APAC. O primeiro passo é buscar, através do nome do paciente, o ID da solicitação referente à APAC que será alterada, utilizando o seguinte comando SQL:

```sql
SELECT sol.id, sol.apa_num, pa.nome nome_paciente, to_char(sol.created , 'yyyy-mm-dd hh24:mi') criado_em FROM po_apacs_solicitacoes sol INNER JOIN po_pacientes pa on sol.paciente_id = pa.id WHERE  pa.nome like '%NOME DO PACIENTE%' ORDER BY id DESC;
```

No resultado da pesquisa, verifique se as colunas apa_num e criado_em de pelo menos uma linha conferem com a APAC e datas informadas. Se sim, memorize o ID (coluna id). Em seguida, execute o comando SQL para realizar a correção, substituindo o número incorreto pelo correto:

```sql
UPDATE po_apacs_solicitacoes 
SET apa_num = '99999999999' /* número correto */
WHERE id = 00000; /* ID da select anterior */
```

Para excluir o número da autorização da APAC, o procedimento é semelhante, mas o comando SQL a ser executado é:

```sql
UPDATE po_apacs_solicitacoes 
SET apa_num = NULL 
WHERE id = 00000; /* ID da select anterior */
```",Esta resposta foi formulada com base no(s) documento(s): POP.SETISD.026 CORRIGIR NÚMERO DE AUTORIZAÇÃO DE UMA APAC.docx
97,Como habilitar chamada em espera?,"Para habilitar a chamada em espera em um ramal, acesse a Central Telefônica através da interface web no endereço 10.100.208.21, entre com o username e password do administrador. Selecione a opção ""PBX Basic"", subitem ""Extensions"" ou através da opção ""System Information"", subitem ""Extensions Status"" e edite as configurações do ramal desejado. Na aba Options, altere o campo ""Options"", item ""Call Waiting"" para Enable. Após alterar, clique em ""Save"" e, em seguida, clique na faixa em vermelho ""Apply Configurations Changes Here"" para aplicar as alterações.",Esta resposta foi formulada com base no(s) documento(s): POP.SETISD.022 HABILITAR CHAMADA EM ESPERA NO RAMAL.docx
98,Como habilitar correio de voz?,"Para habilitar o correio de voz em um ramal, é necessário acessar a Central Telefônica através da interface web, no endereço 10.100.208.21, utilizando o username e password do administrador. Após acessar a central, selecione a opção ""PBX Basic"", subitem ""Extensions"" e edite as configurações do ramal desejado. Na aba ""Voicemail"", marque a caixa ""Enable Voicemail"" e preencha os campos solicitados. Na aba ""Options"", altere o campo ""Call Forward"" e marque a opção ""Voicemail"". Por fim, clique em ""Save"" e ""Apply Configurations Changes Here"".",Esta resposta foi formulada com base no(s) documento(s): POP.SETISD.024 HABILITAR CORREIO DE VOZ NO RAMAL.docx
99,"Como corrigir datas de uma APAC?
","Para corrigir datas de uma APAC, siga os passos abaixo:

1.  **Identificação da Solicitação:** Inicie buscando, pelo nome do paciente, o ID da solicitação referente à APAC que terá a data alterada. Utilize o seguinte comando SQL:
    ```sql
    SELECT sol.id, sol.apa_num, pa.nome nome_paciente, to_char(sol.created , 'yyyy-mm-dd hh24:mi') criado_em FROM po_apacs_solicitacoes sol INNER JOIN po_pacientes pa on sol.paciente_id = pa.id WHERE  pa.nome like '%NOME DO PACIENTE%' ORDER BY id DESC;
    ```
2.  **Localize o ID:** No resultado da pesquisa, verifique se existe algum registro com a APAC (coluna `apa_num`) igual à informada na abertura do chamado. Se sim, memorize o ID (coluna `id`), que será usado na cláusula `WHERE` dos comandos a seguir.

3.  **Tipos de Alteração e Comandos UPDATE:**
    *   **Data de Solicitação, Início e Fim da Validade, e Data da Autorização:** Para ajustar essas datas, execute o seguinte comando, alterando as partes grifadas em verde de acordo com o conteúdo correto:
        ```sql
        UPDATE po_apacs_solicitacoes 
        SET xxxxxxxxxxxxxxxxxx
        WHERE id = 00000; /* ID da select anterior */
        ```
        *   `SET apa_dtiinval = 'AAAA-MM-DD'` (Trocar data de início da validade)
        *   `SET apa_dtfimval = 'AAAA-MM-DD'` (Trocar data de fim da validade)
        *   `SET created = 'AAAA-MM-DD'` (Trocar data de solicitação)
        *   `SET apa_dataut = 'AAAA-MM-DD'` (Trocar data da autorização)
    *   **Data do Início do Tratamento Solicitado e Data da Identificação Patológica:**
        *   Altere a data `apa_dtiinval` na tabela `po_apacs_solicitacoes` como descrito acima.
        *   Ajuste a tabela `po_apacs_qts_rts`. Utilize o ID da pesquisa do comando 1 e execute:
            ```sql
            SELECT * FROM po_apacs_qts_rts WHERE apa_solicitacao_id = 00000 ORDER BY id;
            ```
        *   Verifique se as linhas retornadas correspondem às regras especificadas para `apa_dtintr`, `apa_pr`, e `apa_cmp`. Se precisar atualizar, use o comando:
            ```sql
            UPDATE po_apacs_qts_rts
            SET
                apa_cmp = 202206,        /* Formato AAAAMM */
                apa_pr = '2022-06-01',   /* Formato 'AAAA-MM-DD' */
                apa_dtintr = '2022-06-08',  /* Formato 'AAAA-MM-DD' */
                updated = '2022-06-28 10:32' /* Data e hora da correção */
            WHERE
                id = 88888;
            ```
        *   Para alterar a Data da Identificação Patológica, utilize a mesma consulta anterior (comando 3) e atualize as informações retornadas no campo `apa_dtiden`:
            ```sql
            UPDATE po_apacs_qts_rts
            SET
                apa_cmp = 202206,        /* Formato AAAAMM */
                apa_dtiden = '2022-05-01',  /* Formato 'AAAA-MM-DD' */
                updated = '2022-06-28 10:32' /* Data e hora da correção */
            WHERE
                id = 88888;
            ```

Lembre-se de substituir os valores de exemplo (`AAAA-MM-DD`, `00000`, `88888`, etc.) pelos valores corretos correspondentes ao seu caso.","Esta resposta foi formulada com base no(s) documento(s): POP.SETISD.027 CORRIGIR DATAS (SOLICITAÇÃO, INÍCIO E FIM) DE UMA APAC.docx"
100,"Como atualizar o SISAIH?

","Para atualizar o sistema SISAIH01, siga os seguintes passos:

1.  A solicitação de atualização deve ser efetuada pelo setor responsável, através de chamado no GLPI, informando a nova versão e os computadores a serem atualizados.
2.  Baixe o executável da versão solicitada no site do Datasus: http://sihd.datasus.gov.br/versao/versao_sisaih01.php.
3.  Entre em contato com o setor demandante e solicite que o sistema seja fechado em todos os computadores.
4.  Acesse o servidor Datasus via ""Conexão de Área de Trabalho Remota"" (IP: 10.100.0.51), utilizando o usuário administrador e a senha padrão.
5.  Crie uma pasta com o nº da versão atual e a data (versão_xxxx_ddmmaa) na pasta “SISAIH01”, localizada no disco local D:BKP. Realize o backup da base de dados do SISAIH01 localizada em D:DatasusSISAIH01. Copie os arquivos SISAIH01.GDB, SISAIH00.GDB e SISAIH99.GDB para a pasta criada anteriormente.
6.  Execute o arquivo de instalação da última versão baixada no servidor, clicando em AVANÇAR e depois em CONCLUIR. Após este passo a versão foi atualizada no servidor.
7.  Acesse cada um dos computadores informados no chamado do GLPI pelo VNC Viewer ou UltraVNC e execute o arquivo de instalação da última versão baixada. Clique em AVANÇAR e depois em CONCLUIR.
8.  Feche a conexão com os computadores e com o servidor remoto e finalize o chamado no sistema GLPI.",Esta resposta foi formulada com base no(s) documento(s): POP.SETISD.018 ATUALIZAR SISTEMA SISAIH01.docx
