id,pergunta,resposta,arquivo_fonte
46,Qual o procedimento a ser seguido caso um colaborador apresente um atestado médico superior a 15 dias?,"Caso atestado seja > 15 dias, passará por consulta com a médica do trabalho para avaliação de atestado médico, encaminhado para o INSS, assistente social faz todos os trâmites legais para o encaminhamento do colaborador e ele será acompanhado pela assistente social e o enfermeiro de saúde mental via telefone até o seu retorno. Quando retornar, deverá passar por avaliação ocupacional pela médica do trabalho. Caso esteja apto para retorno, colaborador será liberado para exercer suas atividades laborais. Caso não esteja apto, médica do trabalho e enfermeiro de saúde mental discutem novamente o caso e avaliam a necessidade de avaliação equipe multiprofissional do canal para devidos encaminhamentos, seguindo os mesmos trâmites supracitados.",POP.USOST.012_PADRONIZAR CONDUTA PARA ATENDIMENTO PSICOSSOCIAL DO CANAL DE SAÚDE MENTAL.docx
47,"De acordo com o documento, quais são as responsabilidades da Unidade de Saúde Ocupacional e Saúde do Trabalhador (USOST) em relação ao controle das fichas de EPI?","A Unidade de Saúde Ocupacional e Saúde do Trabalhador é responsável pelo controle das fichas de EPI, sendo assim periodicamente a USOST deverá: Recolher as Fichas de EPI no Almoxarifado Central; Organizar em ordem alfabética; Confeccionar protocolo de entrega em duas vias, das FICHAS DE EPI, contendo a data da entrega, SIAPE, nome e cargo dos empregados; Entregar as FICHAS DE EPI na Unidade de Administração de Pessoal e recolher uma via do protocolo de entrega assinado; Arquivar o protocolo de entrega em pasta arquivo destinada para este fim.",POP.USOST.013 REGISTRAR FORNECIMENTO DE EQUIPAMENTOS DE PROTEÇÃO INDIVIDUAL.docx
48,"Quais são os objetivos da Gerência de Ensino e Pesquisa (GEP) no Hospital Escola da UFPel, conforme descrito no documento?",São objetivos da GEP: auxiliar na formação de recursos humanos nas atividades de ensino desenvolvidas no HE; ampliar o conhecimento e inovação tecnológica através do incentivo à pesquisa; favorecer o desenvolvimento de atividades de extensão universitária.,MA.GEP.001 MANUAL DO RESIDENTE.docx
49,"Qual o endereço eletrônico para acessar a área de ensino do site do Hospital Escola, conforme descrito no documento?",https://www.gov.br/ebserh/pt-br/hospitais-universitarios/regiao-sul/he-ufpel/ensino-e-pesquisa,MA.GEP.001 MANUAL DO RESIDENTE.docx
50,Quais são os horários de funcionamento do restaurante Bandejão e quais os procedimentos para o agendamento das refeições de almoço aos domingos e feriados e jantar diariamente?,"O almoço é servido no restaurante Bandejão das 11h30 às 14h, de segunda a sábado. Aos domingos e feriados, o almoço é servido na copa do HE e requer adesão prévia no sábado ou na véspera do feriado. Para o jantar, a adesão deve ser feita diariamente até às 13h30 do mesmo dia ou pode ser realizada a adesão programada por semana, entrando em contato pelo telefone 3284. 4961 (ligação externa) ou ramal 4961 (ligação interna) - Copa Central.",MA.GEP.001 MANUAL DO RESIDENTE.docx
51,"Quais são os medicamentos que compõem o RHZE, utilizado no tratamento da tuberculose, e em quais dosagens são disponibilizados pelo hospital?",O hospital dispõe de: RHZE (Rifampicina 150mg + Isoniazida 75mg + Pirazinamida 400mg + Etambutol 275mg); RH (Rifampicina 150mg + Isoniazida 75mg); Rifampicina 300 mg; Isoniazida 100 mg.,MA.GEP.001 MANUAL DO RESIDENTE.docx
52,"De acordo com o documento, qual o procedimento para notificação de gestantes com diagnóstico prévio ou atual de sífilis, toxoplasmose e HIV?","GESTANTES com diagnóstico prévio ou atual de sífilis, toxoplasmose e HIV deverão ser notificadas pelo RESIDENTE da obstetrícia, independe da realização de pré-natal ou de já ter sido notificada previamente.",MA.GEP.001 MANUAL DO RESIDENTE.docx
53,"Quais são as faixas etárias atendidas pelo Screening Tool for Risk on Nutritional Status and Growth (STRONGkids-2010), e como é o acompanhamento diário desses pacientes?","Pacientes acima de 1 mês de vida até 17 anos e 11 meses são triados utilizando a ferramenta Screening Tool for Risk on Nutritional Status and Growth (STRONGkids-2010). Os pacientes são visitados diariamente onde são realizadas a avaliação da aceitação da dieta prescrita, avaliação de ingestão, análise da dieta, medidas antropométricas, acompanhamento de exames laboratoriais, adaptação da dieta via oral (consistência, preparações, suplementação, ajuste das necessidades de calorias, macronutrientes e/ou micronutrientes).",MA.GEP.001 MANUAL DO RESIDENTE.docx
54,"Quais são os critérios de inelegibilidade para o Serviço de Atendimento Domiciliar (SAD), conforme descrito no documento?","Residência da pessoa esteja fora dos limites de atuação da UADCP, por exemplo, zona rural da cidade ou municípios vizinhos; ausência de cuidador disponível para receber orientações e auxiliar no cuidado; local de moradia ofereça risco à equipe; não concordância com os termos de atuação da equipe, segundo explicado na primeira avaliação.",MA.GEP.001 MANUAL DO RESIDENTE.docx
55,"Quais escalas são utilizadas para avaliar o risco de quedas em pacientes adultos e crianças, respectivamente, e como são identificados os pacientes adultos com risco alto de quedas?","Para crianças é utilizada a Escala Humpty Dumpty e para os adultos a Morse Fall Scale (MSF). Os pacientes adultos, que apresentem Risco Alto para quedas são identificados com uma pulseira amarela.",MA.GEP.001 MANUAL DO RESIDENTE.docx
56,"De acordo com o texto, qual a exigência do TCLE em relação ao fornecimento do documento original aos participantes da pesquisa, incluindo detalhes sobre assinaturas e rubricas?","O TCLE deve assegurar de forma clara e afirmativa que o participante de pesquisa receberá uma via (e não cópia) do documento, assinada pelo participante de pesquisa (ou seu representante legal) e pelo pesquisador, e rubricada em todas as páginas por ambos.",POP.GEP.029 NORMATIZAÇÃO DO TERMO DE CONSENTIMENTO LIVRE E ESCLARECIDO (TCLE) NO CENTRO DE PESQUISA CLÍNICA.docx
57,"Quais documentos estão disponíveis no site do HE-UFPel para pesquisas acadêmicas, científicas, relatos de casos e estudos clínicos, conforme descrito no documento?",- Termo de Confidencialidade e Sigilo para Coleta de Dados; - Termo de Compromisso de Devolução Científica (não é necessário para estudos clínicos); - Formulário de Solicitação para Consulta de Prontuários e Dados Institucionais (se necessário); - Termo de Autorização de Chefia para Participação em Pesquisa (somente para empregados da EBSERH); - Termo de Consentimento Livre e Esclarecido (TCLE) / Termo de Assentimento Livre e Esclarecido (TALE).,POP.GEP.001 Recebimento da Solicitacao para Realizar Pesquisa no Hospital Escola UFPel V.2.docx
58,"Quais são os objetivos e o material necessário para estabelecer a rotina de criação do processo SEI para solicitações de autorização de pesquisas acadêmicas, científicas, relatos de caso e estudos clínicos no Hospital Escola-UFPEL/Ebserh?","OBJETIVO(S) Estabelecer rotina de criação do processo SEI para solicitação de autorização às chefias dos setores envolvidos, para a realização de pesquisas acadêmicas, científicas, relatos de caso e estudos clínicos no Hospital Escola-UFPEL/Ebserh, bem como manter seus registros atualizados junto ao sistema de informações. MATERIAL Computador com acesso à internet.",POP.GEP.002 Criacao Processo SEI Solicitacao autorizacao as chefias dos setores envolvidos V.2.docx
59,Qual o procedimento a ser seguido pelo responsável pela acolhida 72 horas antes da data agendada para a atividade de acolhimento dos alunos?,O responsável deverá enviar e-mail para o docente responsável pelo estágio confirmando a atividade e que informe os alunos.,POP.GEP.007 Organização das acolhidas aos alunos GRADUAÇÃO E TÉCNICOS.docx
60,"Quais arquivos devem ser anexados ao e-mail enviado aos residentes, supervisores e coordenadores dos programas, conforme descrito no documento?","Programação da Acolhida, Código de Ética e Conduta dos residentes e acadêmicos, Fluxograma de Exposição Biológica, Manual do Residente, Tutorial de Acesso ao Portal de Periódicos da CAPES, Política de Segurança da Informação e Comunicação, Política de Utilização dos Recursos de Tecnologia da Informação no HE-UFPEL, UPTODATE cartão de referência rápida.",POP.GEP.008 Organização das acolhidas aos RESIDENTES.docx
61,"Quais são os materiais necessários para a solicitação de Estágios Curriculares Obrigatórios, conforme descrito no documento?",Computador com Internet; formulário Cronograma de Estágios.,POP.GEP.009 Solicitação de Estágio Curricular Obrigatório.docx
62,"Quais são os semestres do curso de Medicina da UFPEL que englobam as atividades práticas obrigatórias do Internato, consideradas estágios?","O Internato abrange os alunos do 9º, 10º, 11º e 12º semestres do curso e as atividades práticas são consideradas estágios obrigatórios.",POP.GEP.015 FORMALIZAÇÃO DE ESTÁGIO PARA O INTERNATO DO CURSO DE MEDICINA UFPEL.docx
63,"De acordo com o documento, quais são os fins permitidos para a solicitação de consulta e utilização de dados institucionais, listados no Objetivo?","- Apresentação de estudo de caso, caso clínico ou atividade pertencente a disciplina curricular dos cursos; - Obtenção de dados preliminares para elaboração de projeto de pesquisa; - Trabalho para apresentação de evento ou publicação em revista*.",POP.GEP.016 AUTORIZAÇÃO DE CONSULTA E UTILIZAÇÃO DE DADOS INSTITUCIONAIS.docx
64,"Quais são os objetivos e o material necessário para a monitoração das solicitações de uso de dados institucionais e/ou de prontuários, conforme descrito no documento?","OBJETIVOS Monitorar as solicitações de uso de dados institucionais e/ou de prontuários quanto à execução do trabalho, e realizar a cobrança dos resultados, quando houver. A monitorização pode ser realizada semestralmente, nos meses de janeiro e junho. MATERIAL Computador com Internet.",POP.GEP.018 CONTROLE DE RECEBIMENTO DOS RESULTADOS DOS TRABALHOS QUE UTILIZARAM DADOS DE PRONTUÁRIOS OU INSTITUCIONAIS.docx
65,"Qual o material necessário para realizar o agendamento pontual das salas de ensino e de orientação (QG) no Hospital Escola da UFPel, de acordo com o documento?","Computador com Internet, telefone, Sistema de Agendamento de Salas (SAS) disponível no site do HE-UFPel.",POP.GEP.019 Agendamento Pontual de Salas de Ensino e Orientação (QG).docx
66,"De acordo com o documento, quais são os materiais necessários para realizar o agendamento permanente de salas de ensino e de orientação?","Computador com Internet, telefone, Sistema de Agendamento de Salas (SAS) disponível no site do HE-UFPel.",POP.GEP.020 Agendamento Permanente de Salas de Ensino e Orientação (QG).docx
67,"Quais os formulários necessários para a solicitação e relatório de um Projeto de Atuação/Intervenção no Hospital Escola UFPEL, conforme descrito no documento?",Formulário “Solicitação para realização de Projeto de Atuação/Intervenção no Hospital Escola UFPEL” GEP-007; Formulário “Relatório de Apresentação dos Resultados -  Projeto de Atuação/Intervenção” GEP-012,POP.GEP.021 Formalização de Projeto de Atuação revisado versão final.docx
68,"Quais são os materiais necessários para solicitar um parecer do setor/unidade e autorização institucional para desenvolvimento de um Projeto de Ensino/Liga Acadêmica no Hospital Escola UFPEL/EBSERH, de acordo com o documento?","Computador com Internet; Formulário “Solicitação para Realizar Projeto de Ensino/Extensão no Hospital Escola e Outras Unidades” (Site HE UFPEL), programa ADS Ensino.",POP.GEP.022 Projeto de Ensino.docx
69,"Quais materiais são necessários para a confecção de segunda via do crachá, de acordo com o documento?",Computador com Internet (Acesso ao ADS Hospitalar); Programa (POWER POINT); PEN DRIVE; Impressora; Folha A4; Plástico Polaseal; Plastificadora (Poliseladora).,POP.GEP.024 SOLICITAÇÃO DE 2ª VIA DE CRACHÁ HOSPITAL ESCOLA UFPELEBSERH.docx
70,"Quais são os papéis dos executores envolvidos no processo após a avaliação do Estudo Clínico pelo Comitê de Ética em Pesquisa (CEP), conforme descrito na seção 'Descrição das atividades'?","Investigador Principal - CPC, Sub Investigador - CPC, Coordenador de Pesquisa – CPC, Monitor de Pesquisa, Patrocinador do estudo",POP.GEP.027 PROCESSO PÓS-AVALIAÇÃO DO ESTUDO CLÍNICO PELO COMITÊ DE ÉTICA EM PESQUISA (CEP).docx
71,"Quais são os executores do processo de agendamento de visita, auditoria e inspeção regulatória ao Centro de Pesquisa Clínica (CPC), de acordo com o documento?","Auditor, Monitor e Coordenador de Pesquisa - CPC",POP.GEP.028 AGENDAMENTO DE VISITA AO CENTRO DE PESQUISA CLÍNICA (CPC).docx
72,"De acordo com a descrição dos procedimentos, quais medidas de segurança e protocolos foram implementados para os participantes das pesquisas clínicas com suspeita ou confirmação de COVID-19 no Centro de Pesquisa Clínica (CPC) durante o período da pandemia?","Caso o participante, esteja com suspeita e/ou confirmação de COVID-19, será adiado seu comparecimento ao Centro de Pesquisa. Quando for imprescindível a vinda dos participantes confirmados e/ou suspeitos de COVID-19 ao Centro de Pesquisa, os atendimentos ocorrerão, preferencialmente, no Consultório de Pesquisa 3, cujo acesso é separado das demais instalações do CPC. Os profissionais deverão paramentar-se conforme MA. HE. 004 Manual de Biossegurança e Precauções na Assistência (disponível no site do Hospital Escola -> Intranet -> Documentos e manuais -> Manuais, POP’s e Protocolos Aprovados pela Qualidade -> Manuais/GAS). Após o atendimento será realizada a desinfecção terminal deste consultório.",POP.GEP.037 COMPARECIMENTO DE PARTICIPANTES DAS PESQUISAS NO CENTRO DE PESQUISA CLÍNICA DURANTE A PANDEMIA DE COVID-19.docx
73,"Quais são os documentos e plataformas utilizados para registro e arquivamento dos treinamentos da equipe do Centro de Pesquisa Clínica, de acordo com o documento?","O registro dos treinamentos internos será registrado no formulário CPC – 006 Registro de Treinamento (disponível no sistema ADS Hospitalar, aba documentos, pasta Centro de Pesquisas Clínicas). O registro será arquivado na pasta de regulatório do Centro de Pesquisa Clínica e anexado ao processo SEI correspondente ao estudo.",POP.GEP.041 TREINAMENTOS DA EQUIPE DO.docx
74,"De acordo com o documento, quais são os pontos fundamentais que o conteúdo do Parecer Técnico-Científico (PTC) deve considerar?",a descrição dos aspectos epidemiológicos da condição de saúde à qual a tecnologia será destinada; a descrição do tratamento recomendado e da tecnologia a ser avaliada; a pergunta a ser respondida pelo parecer; as fontes de informação utilizadas; a descrição do método; a síntese e a qualidade das evidências disponíveis; os resultados encontrados e as recomendações.,POP.GEP.042 AVALIAR TECNOLOGIAS EM SAÚDE E EMITIR PARECER TÉCNICO CIENTÍFICO (PTC) - V. 02.docx
75,"como faço para excluir uma apac do sistema ADSHospitalar?
","Para desativar uma APAC no sistema ADSHospitalar, a TI deve tomar conhecimento através de um chamado aberto no GLPI, contendo o nome completo do paciente e o número ou data da APAC. Em vez de excluir, o procedimento correto é inativar a APAC no banco de dados. Para isso, busca-se o ID da solicitação referente à APAC informada através do nome do paciente. Em seguida, executa-se um comando SQL para atualizar o status da APAC para 'I' (inativo), utilizando o ID encontrado como condicional.",Esta resposta foi formulada com base no(s) documento(s): POP.SETISD.029 EXCLUIR UMA APAC.docx
76,"Como abro um chamado para a Ti utilizando o sistema GLPI?

","O sistema GLPI deve ser utilizado para abrir chamados referentes aos recursos de informática e telecomunicações do Hospital Escola, tais como casos de falhas em sistemas/equipamentos de TI, instalação de equipamentos/sistemas, melhorias em processos de sistemas, permissão de acesso aos sistemas geridos pelo SETISD, instalação/manutenção de ramais telefônicos, instalação/manutenção de computadores, manutenção em impressoras e dúvidas de informática em geral. Para abrir um chamado, o usuário deve acessar o sistema GLPI e informar sua dúvida. Se o contato tiver sido efetuado apenas por telefone e não exista chamado registrado no sistema, o colaborador do SETISD deverá orientar para que o usuário formalize a sua dúvida via GLPI, para que este atendimento seja formalizado e contabilizado junto com os outros atendimentos realizados pelo setor.","Esta resposta foi formulada com base no(s) documento(s): POP.SETISD.002 RESPONDER DÚVIDAS DE TECNOLOGIA DA INFORMAÇÃO.docx, POP.SETISD.001 RECEBER E EXECUTAR CHAMADO ATRAVÉS DA FERRAMENTA GLPI.docx"
77,"como fazer para criar um novo ramal voip?


","Para criar um novo ramal VoIP, acesse a Central Telefônica através da interface web no endereço 10.100.208.21, entre com o username e password do administrador. Selecione a opção ""PBX Basic"", subitem ""Extensions"" e clique em ""+ Add"". Na aba General, preencha os campos Extension Number, Display Name e Caller ID Number com o número do ramal. Em Authentication, preencha o campo Register Name com o mesmo número do ramal e defina uma senha padrão. Mantenha os demais campos da aba General como estão. Por padrão, mantenha a caixa de mensagens de voz desabilitada na aba Voicemail. Na aba Options, mantenha as caixas de encaminhamento de chamada desabilitadas. Na aba Other, desabilite a caixa Web Login. Clique em ""Save"" e depois em ""Apply Configurations Changes Here"".",Esta resposta foi formulada com base no(s) documento(s): POP.SETISD.021 CRIAR RAMAL VOIP.docx
78,"como faço para atribuir perfil no sistema ADSHospitalar?


","Para atribuir um perfil no sistema ADSHospitalar, siga os passos:

1.  Acesse o sistema AGHUx para obter o CPF do colaborador.
2.  Acesse o sistema ADSAcesso para verificar se o colaborador já possui cadastro. Se não, crie o usuário informando os dados obrigatórios.
3.  Acesse o menu Senhas e preencha os campos para criar o acesso ao sistema ADSHospitalar, utilizando o número do conselho para colaboradores assistenciais/médicos/farmacêuticos/bioquímicos e o login de rede para administrativos.
4.  Caso o usuário já possua cadastro, verifique os perfis que ele acessa via base de dados e remova o usuário dos grupos aos quais ele não pode ter acesso, conforme a tabela padrão de perfis no One Drive da USID.
5.  Adicione a permissão ao usuário com base na planilha de perfil disponível no One Drive da USID.
6.  Remova os grupos que não estão na listagem padrão de Grupos do ADS Hospitalar no sistema ADSAcesso.
7.  Acesse o grupo desejado e inclua ou remova o usuário conforme a permissão necessária.",Esta resposta foi formulada com base no(s) documento(s): POP.SETISD.004 ATRIBUIR PERFIL NO SISTEMA ADSHOSPITALAR.docx
79,"o que fazer para incluir um novo leito no sistema AGHU?
","Para cadastrar um novo leito no sistema AGHU, acesse o sistema AGHUx através do link https://aghu.heufpel.com.br/. No menu, vá em Internação -> Cadastros -> Quartos e Leitos -> Quartos e Leitos. Pesquise a enfermaria desejada, clicando no ícone de edição. Na tela Cadastrar Quarto, clique no botão Adicionar para criar um novo leito para a enfermaria. Preencha todos os campos no formulário de cadastro de leitos e selecione todos os campos. Após o preenchimento, clique no botão Confirmar e depois no botão Gravar para salvar as informações. Para verificar o novo leito, vá no menu Internação -> Censo Diário dos Pacientes, selecione a unidade funcional da enfermaria e clique em Pesquisar. Se o leito estiver desativado, clique no ícone para ativá-lo.",Esta resposta foi formulada com base no(s) documento(s): POP.SETISD.011 CADASTRAR LEITOS NO SISTEMA AGHUX.docx
80,"Como atender um chamado através do sistema GLPI?

","Para atender um chamado através do sistema GLPI, siga os seguintes passos:

1.  Assim que um novo chamado é criado/enviado, o sistema de chamados emite um alerta sonoro no Setor de Tecnologia da Informação e Saúde Digital.
2.  Um dos técnicos deve analisar o novo chamado através do sistema GLPI, disponível no link: http://glpi.heufpel.com.br/glpi.
3.  O técnico irá conferir o tipo do chamado, a categoria e a localização e, se for necessário, fará as correções. O tempo de solução é calculado automaticamente conforme o Acordo em Nível de Serviço (SLA).
4.  O técnico poderá atribuir o chamado para si ou para outro colaborador/grupo mais apropriado para esta tarefa (situação atribuído). Se o técnico tiver dúvidas ou faltarem informações, ele deverá incluir um acompanhamento no chamado, através do menu Processando chamado -> Acompanhamento. Este acompanhamento será encaminhado por e-mail ao colaborador que abriu o chamado. Neste caso, o técnico deverá alterar a situação do chamado para “Aguardando feedback”. O colaborador que abriu o chamado deverá responder no próprio chamado, através da inclusão de um acompanhamento.
5.  Assim que a execução do chamado for iniciada, o mesmo deverá ser colocado na situação “em atendimento”. Caso o chamado esteja aguardando alguma pendência externa para ser solucionado (por exemplo: chegada de um equipamento, resolução de chamado pela sede etc.), o mesmo deverá ser colocado na situação “pendente”, na qual o tempo de solução será pausado.
6. Quando o atendimento for finalizado o colaborador deverá encerrar o chamado, através do menu Processando chamado -> Solução. Deve ser selecionado um modelo de solução e inserido uma descrição de acordo com o que foi realizado durante o atendimento. Caso não seja possível solucionar, a justificativa também deverá ser incluída na descrição, ficando o chamado com a situação “Solucionado”.
7. O usuário irá receber um e-mail, indicando que o chamado foi solucionado e a solução que foi aplicada. Neste caso, o usuário deverá aprovar ou recusar a solução e preencher a pesquisa de satisfação para que o chamado seja efetivamente finalizado. Em caso de recusa da solução o chamado será automaticamente reaberto. Caso o usuário não aprove ou recuse a solução em até 48 horas, o chamado será finalizado automaticamente pelo sistema.",Esta resposta foi formulada com base no(s) documento(s): POP.SETISD.001 RECEBER E EXECUTAR CHAMADO ATRAVÉS DA FERRAMENTA GLPI.docx
81,"Como liberar perfil no sistema AGHUX?


","Para liberar o perfil no sistema AGHUx, primeiramente efetue uma busca pelo nome do colaborador através do módulo Servidores, usando o menu Outros Módulos > Colaborador > Administrar Servidor > Servidores. Busque o nome do colaborador no campo Pessoa e clique em pesquisar. Clique sobre o botão editar para verificar os dados do servidor. Após verificar qual perfil deverá ser atribuído para o colaborador, faça a importação do usuário para o AGHUx, através do menu Outros Módulos > Configuração > Acesso > Usuário. Digite o login do colaborador e clique em Pesquisar. Caso seja um colaborador novo, clique em Importar Usuário e faça novamente a pesquisa pelo login do Servidor. Caso o sistema apresente o login na listagem, clique em Adicionar e preencha as informações do usuário, informando o e-mail pessoal ou institucional do colaborador e marcando que o usuário está ativo. Para adicionar o perfil ao usuário, clique em Editar Perfil, preencha o nome do perfil, selecione-o no menu suspenso e clique em Adicionar. Após adicionar os perfis, clique em Gravar, para finalizar a vinculação dos perfis ao usuário do colaborador. Para vincular o usuário ao cadastro do Servidor, insira o login do funcionário no campo Login, dentro do cadastro do Servidor, através do menu Outros Módulos > Colaborador > Administrar Servidor > Servidores. Verifique se o login já está associado ao cadastro do servidor. Caso não esteja, digite o login no campo login, selecione-o no menu suspenso e pressione o botão Gravar.",Esta resposta foi formulada com base no(s) documento(s): POP.SETISD.003 ATRIBUIR PERFIL DE ACESSO AO SISTEMA AGHUX.docx
82,"Como liberar perfil no sistema ADS Hospitalar?



","Para atribuir o perfil de acesso ao sistema ADSHospitalar, é necessário acessar o sistema ADSAcesso, verificar se o colaborador já possui cadastro de usuário, e em seguida, criar o acesso ao sistema no menu Senhas. No formulário de cadastro de acesso, preencha os campos Cliente, Usuário, Sistema e Login de acordo com o tipo de colaborador (assistencial/médico/administrativo). Informe uma senha padrão (que não será informada ao usuário). Se o usuário já possuir cadastro, verifique os perfis que ele acessa via base de dados e remova os acessos indevidos, conforme a tabela padrão de perfis no One Drive da USID. No cadastro do usuário, adicione a permissão com base na planilha de perfil do One Drive da USID e remova os grupos que não estão na listagem padrão de Grupos do ADS Hospitalar. Acesse o sistema ADSAcesso, vá no menu Grupos, pesquise o grupo desejado e edite-o para incluir ou remover o usuário, salvando as alterações.",Esta resposta foi formulada com base no(s) documento(s): POP.SETISD.004 ATRIBUIR PERFIL NO SISTEMA ADSHOSPITALAR.docx
